{
  "problem_type": "CVRPTW",
  "full_name": "Capacitated Vehicle Routing Problem with Time Windows",
  "summary": "CVRPTW: capacity plus time windows on POMO's CVRP environment. Travel time IS the Euclidean distance -- no vehicle speed is introduced anywhere. The rollout is the unmodified POMO decoder (encoder input frozen at 2 dims for the depot and 3 dims for a node, so the pretrained encoder still loads), driven by one action mask. Per decision step (batch b, rollout p, candidate node j) the mask is the union of four predicates: (i) j already served (existing visited rule), (ii) the route load would exceed capacity (existing capacity rule, kept in POMO's normalized units where the tank starts at 1.0), (iii) arrival(b,p,j) = current_time[b,p] + ||xy[current_node[b,p]] - xy[j]|| > due_j - 1e-3, (iv) completion = max(arrival, ready_j) + service_j > horizon - 1e-3. Index 0 (the depot) is exempt from (iii) and (iv), never masked by (ii) because its demand is 0, and is deliberately re-opened by the existing visited rule whenever the vehicle is not standing on it -- that exception is what makes the state deadlock-free: a state in which no customer is reachable can always be escaped by returning to the depot, where current_time resets to 0 and every remaining customer is admissible again (measured on all three shipped n=100 instances: min_j(due_j - dist(0,j)) = 0.496 and 0 customers whose direct depot trip leaves the horizon). The only two selections that do not consult the mask are POMO's fixed first two moves (depot; rollout p starts at customer p+1), which the same measurement makes safe, and which the run path must therefore re-validate before dumping. Objective: minimize total travel distance; POMO's reward is its negative. Feasibility must not depend on the learned weights -- with an empty checkpoints/ drop box the trajectory is still feasible, only worse.",
  "constraints": [
    {
      "id": "C1",
      "name": "Visit once",
      "rule": "every customer id 1..n must be served exactly once across all routes: never twice, and none left unserved when the rollout terminates."
    },
    {
      "id": "C2",
      "name": "Capacity",
      "rule": "the served demand on a route must never exceed the vehicle capacity: sum(demand_i) <= capacity, equivalently sum(demand_i / capacity) <= 1.0 in the environment's normalized units."
    },
    {
      "id": "C3",
      "name": "Time window",
      "rule": "arrival at customer j must satisfy arrival <= due_j; early arrival is legal and the vehicle waits (start = max(arrival, ready_j)). Arrival is measured on the distance-based clock, per `semantics`."
    },
    {
      "id": "C4",
      "name": "Horizon",
      "rule": "service at any served customer must complete by the depot's closing time: max(arrival, ready_j) + service_j <= horizon, where horizon = time_windows[0][1]."
    },
    {
      "id": "C5",
      "name": "Depot route shape",
      "rule": "every route is a list of node ids that starts at 0, ends at 0, and contains no customer before its start or after its end; only the depot may appear more than once in the sequence."
    }
  ],
  "state_variables": [
    {
      "name": "depot_node_xy",
      "shape": "(batch, n+1, 2)",
      "dtype": "float32",
      "update": "static per episode: torch.cat((depot_xy, node_xy), dim=1) in load_problems; augmented 8-fold with the other coordinate tensors.",
      "reason": "existing POMO state; the only place the encoder reads from, and therefore frozen."
    },
    {
      "name": "depot_node_demand",
      "shape": "(batch, n+1)",
      "dtype": "float32",
      "update": "static per episode: depot demand 0 followed by node_demand / capacity (normalized units).",
      "reason": "existing POMO state; feeds the capacity mask. The division by the instance's capacity on JSON load is new and mandatory."
    },
    {
      "name": "time_windows",
      "shape": "(batch, n+1, 2)",
      "dtype": "float32",
      "update": "static per episode: loaded from the instance json ([ready, due] per node, index 0 = [0, horizon]); for random training instances generated together with the coordinates; under 8-fold augmentation it is node_demand.repeat(8, 1) -- repeated, never transformed.",
      "reason": "the ready/due pair every mask and every clock update reads. The 8 augmentation transforms are reflections and a transpose, i.e. isometries, so pairwise distances (and therefore windows derived from distances) are unchanged; transforming the windows would be wrong."
    },
    {
      "name": "service_times",
      "shape": "(batch, n+1)",
      "dtype": "float32",
      "update": "static per episode: index 0 = 0.0, customers carry the instance's service time (0.05 in the shipped data).",
      "reason": "the clock advances by the service time of the node just served."
    },
    {
      "name": "current_time",
      "shape": "(batch, pomo)",
      "dtype": "float32",
      "update": "reset to 0; per step: arrival = current_time + dist(previous_node, selected); current_time = max(arrival, ready_selected) + service_selected; set to 0 wherever at_the_depot.",
      "reason": "new dynamic state. This is the only time quantity that exists at a decision step, and it is exactly what the checker's replay calls `now`."
    },
    {
      "name": "load",
      "shape": "(batch, pomo)",
      "dtype": "float32",
      "update": "existing POMO update: load -= demand[selected]; load[at_the_depot] = 1 (refill).",
      "reason": "the remaining capacity fraction; the capacity mask is load + eps < demand."
    },
    {
      "name": "current_node",
      "shape": "(batch, pomo)",
      "dtype": "int64",
      "update": "existing: current_node = selected at the top of step().",
      "reason": "the origin of every candidate arrival. Trap: the arrival leg must be computed with the PREVIOUS node before this assignment happens, otherwise dist(j,j)=0."
    },
    {
      "name": "visited_ninf_flag",
      "shape": "(batch, pomo, n+1)",
      "dtype": "float32",
      "update": "existing: -inf at the selected node; index 0 is set back to 0 whenever the vehicle is not at the depot.",
      "reason": "carries both the visit-once constraint and the depot-reopening exception."
    },
    {
      "name": "ninf_mask",
      "shape": "(batch, pomo, n+1)",
      "dtype": "float32",
      "update": "composed at the end of every step(): clone of visited_ninf_flag, then capacity, then time window, then horizon, then index 0 forced back to 0, then the existing finished reopen.",
      "reason": "the single tensor the decoder consumes; its shape and -inf semantics must not change."
    },
    {
      "name": "finished",
      "shape": "(batch, pomo)",
      "dtype": "bool",
      "update": "existing: True once the visited rule masks every customer; the mask then leaves only the depot, which terminates the sequence.",
      "reason": "rollout termination; also the reason a completed route always ends on node 0."
    },
    {
      "name": "selected_node_list",
      "shape": "(batch, pomo, T)",
      "dtype": "int64",
      "update": "existing: the selected node ids appended once per step, starting with the depot at t=0.",
      "reason": "the route sequence source for the solution dump: split at 0, drop the leading empty segment, and drop any [0, 0] idle segment."
    }
  ],
  "masking_rules": [
    {
      "name": "visited_mask",
      "condition": "visited_ninf_flag[b, p, j] == -inf, i.e. customer j (j >= 1) has already been served; j = 0 is exempt.",
      "tensor": "visited_ninf_flag",
      "shape": "(batch, pomo, n+1)",
      "exception": "index 0 is set back to 0 whenever at_the_depot is False (visited_ninf_flag[:, :, 0][~at_the_depot] = 0), so the depot can always be selected from anywhere; while the vehicle stands on the depot the depot itself stays masked, which is what stops depot->depot idling.",
      "notes": "existing baseline rule, unchanged (the block is inline in CVRPEnv.step; there is no _get_logit_mask / _update_ninf_mask in this baseline)."
    },
    {
      "name": "capacity_mask",
      "condition": "demand_j > load[b, p] - CAP_MARGIN, with CAP_MARGIN = 1e-5 in normalized units, i.e. demask only when the remaining load covers the demand with room to spare.",
      "tensor": "ninf_mask",
      "shape": "(batch, pomo, n+1)",
      "exception": "index 0 has demand 0 and is never masked by this rule. POMO's baseline tolerance is used the other way round: `load + round_error_epsilon < demand` admits an overshoot of 1e-5 normalized = 3e-4 raw units with capacity 30.0, while the independent checker tolerates 1e-6 raw -- so the comparison must be rewritten conservatively (`demand > load - CAP_MARGIN`), not copied verbatim.",
      "notes": "existing rule, tighter tolerance. The unit mismatch is deliberate: the margin is chosen so a route can never exceed capacity in the checker's raw units."
    },
    {
      "name": "time_window_mask",
      "condition": "arrival(b,p,j) > due_j - TIME_MARGIN, where arrival(b,p,j) = current_time[b,p] + dist(depot_node_xy[b, current_node[b,p]], depot_node_xy[b, j]) and TIME_MARGIN = 1e-3 raw units; index 0 exempt.",
      "tensor": "ninf_mask",
      "shape": "(batch, pomo, n+1)",
      "exception": "index 0 (the depot) is exempt and forced back to 0 whichever way the test comes out (ninf_mask[:, :, 0] = 0). Without this exemption a vehicle whose clock has passed the horizon would find its own depot masked and the state would have no legal action at all.",
      "notes": "new. Only state that exists at the decision step is used: current_node, current_time, the instance coordinates and the instance windows -- no departure-time or lookahead quantity. The 1e-3 margin is set in the checker's raw units: the environment accumulates the clock in float32 over up to ~101 legs while the checker accumulates in float64, so a mask that sits exactly on the boundary can pass the mask and still violate the replay."
    },
    {